{
  "id": "draft-demo-001",
  "observation_id": "obs-demo-001",
  "title": "[Staging 演示] Guest 点击继续付款后页面持续 Loading",
  "environment": "staging-demo",
  "steps_to_reproduce": [
    "Open guest booking summary",
    "点击“继续付款”按钮"
  ],
  "expected": "仍有应付金额时应进入付款步骤（QA 提供的预期，尚未验证）。",
  "actual": "页面持续 Loading，未发生跳转。",
  "evidence_refs": [
    "ev-action-01",
    "ev-network-01",
    "ev-screen-01"
  ],
  "diagnosis_report_id": "diag-demo-001",
  "suggested_team": "example-payment-team",
  "approval_status": "pending_review"
}
